{
  "schemaVersion": "WorkflowRootRegistryV1",
  "sourceEvidence": [
    {
      "ref": "content:instructions/01-common.instructions.md",
      "digest": "299671b1c6068e8eae60c82202cdbddd6e530672b60e21fa7f590fd608bd7ae3"
    },
    {
      "ref": "content:skills/routing/SKILL.md",
      "digest": "504d76a939fdf0bec87590a91a03c93541de75d56b43b0d59a390cd3f2e2fc36"
    },
    {
      "ref": "scripts/lib/host-parity-scorecard.js",
      "digest": "7c46243482b4cadf24d9351f96f397f9b16550056d6e6af3bb469a8668de13ba"
    }
  ],
  "sourceDigest": "0bfc41394956c2c9316c90b43590423148be3f8b77e9775e5804948c465bc5bf",
  "baseBundles": {
    "chat": [],
    "resume": [
      {
        "skillId": "intent",
        "budgetClass": "hard",
        "loadStage": "entry"
      },
      {
        "skillId": "compliance",
        "budgetClass": "hard",
        "loadStage": "entry"
      },
      {
        "skillId": "user-visible-output-contract",
        "budgetClass": "hard",
        "loadStage": "entry"
      },
      {
        "skillId": "memory",
        "budgetClass": "hard",
        "loadStage": "closeout"
      }
    ],
    "analyze": [
      {
        "skillId": "intent",
        "budgetClass": "hard",
        "loadStage": "entry"
      },
      {
        "skillId": "compliance",
        "budgetClass": "hard",
        "loadStage": "entry"
      },
      {
        "skillId": "user-visible-output-contract",
        "budgetClass": "hard",
        "loadStage": "entry"
      },
      {
        "skillId": "report",
        "budgetClass": "hard",
        "loadStage": "closeout"
      },
      {
        "skillId": "memory",
        "budgetClass": "hard",
        "loadStage": "closeout"
      }
    ],
    "audit": [
      {
        "skillId": "intent",
        "budgetClass": "hard",
        "loadStage": "entry"
      },
      {
        "skillId": "compliance",
        "budgetClass": "hard",
        "loadStage": "entry"
      },
      {
        "skillId": "user-visible-output-contract",
        "budgetClass": "hard",
        "loadStage": "entry"
      },
      {
        "skillId": "report",
        "budgetClass": "hard",
        "loadStage": "closeout"
      },
      {
        "skillId": "memory",
        "budgetClass": "hard",
        "loadStage": "closeout"
      },
      {
        "skillId": "skill-gap-analysis",
        "budgetClass": "hard",
        "loadStage": "execution:audit-preflight"
      },
      {
        "skillId": "load-profile",
        "budgetClass": "hard",
        "loadStage": "execution:audit-preflight"
      }
    ],
    "dev": [
      {
        "skillId": "intent",
        "budgetClass": "hard",
        "loadStage": "entry"
      },
      {
        "skillId": "compliance",
        "budgetClass": "hard",
        "loadStage": "entry"
      },
      {
        "skillId": "user-visible-output-contract",
        "budgetClass": "hard",
        "loadStage": "entry"
      },
      {
        "skillId": "report",
        "budgetClass": "hard",
        "loadStage": "closeout"
      },
      {
        "skillId": "memory",
        "budgetClass": "hard",
        "loadStage": "closeout"
      }
    ],
    "fix": [
      {
        "skillId": "intent",
        "budgetClass": "hard",
        "loadStage": "entry"
      },
      {
        "skillId": "compliance",
        "budgetClass": "hard",
        "loadStage": "entry"
      },
      {
        "skillId": "user-visible-output-contract",
        "budgetClass": "hard",
        "loadStage": "entry"
      },
      {
        "skillId": "report",
        "budgetClass": "hard",
        "loadStage": "closeout"
      },
      {
        "skillId": "memory",
        "budgetClass": "hard",
        "loadStage": "closeout"
      }
    ],
    "self-fix": [
      {
        "skillId": "intent",
        "budgetClass": "hard",
        "loadStage": "entry"
      },
      {
        "skillId": "compliance",
        "budgetClass": "hard",
        "loadStage": "entry"
      },
      {
        "skillId": "user-visible-output-contract",
        "budgetClass": "hard",
        "loadStage": "entry"
      },
      {
        "skillId": "report",
        "budgetClass": "hard",
        "loadStage": "closeout"
      },
      {
        "skillId": "memory",
        "budgetClass": "hard",
        "loadStage": "closeout"
      }
    ],
    "other": [
      {
        "skillId": "intent",
        "budgetClass": "hard",
        "loadStage": "entry"
      },
      {
        "skillId": "compliance",
        "budgetClass": "hard",
        "loadStage": "entry"
      },
      {
        "skillId": "user-visible-output-contract",
        "budgetClass": "hard",
        "loadStage": "entry"
      },
      {
        "skillId": "report",
        "budgetClass": "hard",
        "loadStage": "closeout"
      },
      {
        "skillId": "memory",
        "budgetClass": "hard",
        "loadStage": "closeout"
      }
    ]
  },
  "routes": [
    {
      "routeKey": "dev.default",
      "roots": [
        {
          "skillId": "dev-default",
          "budgetClass": "hard",
          "loadStage": "entry"
        },
        {
          "skillId": "cp-gate",
          "budgetClass": "hard",
          "loadStage": "entry"
        },
        {
          "skillId": "dev-plan-review",
          "budgetClass": "hard",
          "loadStage": "entry"
        }
      ]
    },
    {
      "routeKey": "dev.refactor",
      "roots": [
        {
          "skillId": "dev-refactor",
          "budgetClass": "hard",
          "loadStage": "entry"
        },
        {
          "skillId": "cp-gate",
          "budgetClass": "hard",
          "loadStage": "entry"
        },
        {
          "skillId": "dev-plan-review",
          "budgetClass": "hard",
          "loadStage": "entry"
        }
      ]
    },
    {
      "routeKey": "dev.database",
      "roots": [
        {
          "skillId": "dev-database",
          "budgetClass": "hard",
          "loadStage": "entry"
        },
        {
          "skillId": "cp-gate",
          "budgetClass": "hard",
          "loadStage": "entry"
        },
        {
          "skillId": "dev-plan-review",
          "budgetClass": "hard",
          "loadStage": "entry"
        }
      ]
    },
    {
      "routeKey": "dev.init",
      "roots": [
        {
          "skillId": "dev-init",
          "budgetClass": "hard",
          "loadStage": "entry"
        }
      ]
    },
    {
      "routeKey": "dev.optimization",
      "roots": [
        {
          "skillId": "dev-optimization",
          "budgetClass": "hard",
          "loadStage": "entry"
        },
        {
          "skillId": "cp-gate",
          "budgetClass": "hard",
          "loadStage": "entry"
        },
        {
          "skillId": "dev-plan-review",
          "budgetClass": "hard",
          "loadStage": "entry"
        }
      ]
    },
    {
      "routeKey": "dev.scenario-test",
      "roots": [
        {
          "skillId": "dev-scenario-test",
          "budgetClass": "hard",
          "loadStage": "entry"
        },
        {
          "skillId": "cp-gate",
          "budgetClass": "hard",
          "loadStage": "entry"
        }
      ]
    },
    {
      "routeKey": "dev.docs",
      "roots": [
        {
          "skillId": "dev-docs",
          "budgetClass": "hard",
          "loadStage": "entry"
        },
        {
          "skillId": "cp-gate",
          "budgetClass": "hard",
          "loadStage": "entry"
        }
      ]
    },
    {
      "routeKey": "dev.plan-review",
      "roots": [
        {
          "skillId": "dev-plan-review",
          "budgetClass": "hard",
          "loadStage": "entry"
        }
      ]
    },
    {
      "routeKey": "fix.default",
      "roots": [
        {
          "skillId": "fix-default",
          "budgetClass": "hard",
          "loadStage": "entry"
        },
        {
          "skillId": "cp-gate",
          "budgetClass": "hard",
          "loadStage": "entry"
        }
      ]
    },
    {
      "routeKey": "fix.security",
      "roots": [
        {
          "skillId": "fix-security",
          "budgetClass": "hard",
          "loadStage": "entry"
        },
        {
          "skillId": "cp-gate",
          "budgetClass": "hard",
          "loadStage": "entry"
        }
      ]
    },
    {
      "routeKey": "fix.incident",
      "roots": []
    },
    {
      "routeKey": "audit.规范文件",
      "roots": [
        {
          "skillId": "audit-common",
          "budgetClass": "hard",
          "loadStage": "entry"
        },
        {
          "skillId": "audit-dimensions",
          "budgetClass": "hard",
          "loadStage": "entry"
        },
        {
          "skillId": "audit-execution-guide",
          "budgetClass": "hard",
          "loadStage": "entry"
        },
        {
          "skillId": "audit-session",
          "budgetClass": "hard",
          "loadStage": "entry"
        }
      ]
    },
    {
      "routeKey": "audit.技术方案",
      "roots": [
        {
          "skillId": "audit-common",
          "budgetClass": "hard",
          "loadStage": "entry"
        },
        {
          "skillId": "audit-tech-design",
          "budgetClass": "hard",
          "loadStage": "entry"
        },
        {
          "skillId": "audit-session",
          "budgetClass": "hard",
          "loadStage": "entry"
        }
      ]
    },
    {
      "routeKey": "audit.需求文档",
      "roots": [
        {
          "skillId": "audit-common",
          "budgetClass": "hard",
          "loadStage": "entry"
        },
        {
          "skillId": "audit-requirements",
          "budgetClass": "hard",
          "loadStage": "entry"
        },
        {
          "skillId": "audit-session",
          "budgetClass": "hard",
          "loadStage": "entry"
        }
      ]
    },
    {
      "routeKey": "audit.项目工程",
      "roots": [
        {
          "skillId": "audit-common",
          "budgetClass": "hard",
          "loadStage": "entry"
        },
        {